{
  "approved_on": "2026-07-29",
  "asset_selection": {
    "candidate_assets": [
      "SPY",
      "QQQ",
      "AAPL",
      "MSFT",
      "NVDA",
      "TSLA",
      "AMZN",
      "META"
    ],
    "outcome_blind": true,
    "retained_count_max": 6,
    "retained_count_min": 4
  },
  "b2_feature_names": [
    "b2_log_trade_count",
    "b2_unique_contract_share",
    "b2_log_mean_trade_premium",
    "b2_log_max_trade_premium",
    "b2_call_put_premium_imbalance_scaled",
    "b2_execution_side_premium_imbalance",
    "b2_repeated_contract_premium_share",
    "b2_strike_concentration",
    "b2_expiry_concentration"
  ],
  "development_sessions": [
    "2026-03-24",
    "2026-03-25",
    "2026-03-26",
    "2026-03-27",
    "2026-03-30",
    "2026-03-31",
    "2026-04-01",
    "2026-04-02",
    "2026-04-06",
    "2026-04-07",
    "2026-04-08",
    "2026-04-09",
    "2026-04-10",
    "2026-04-13",
    "2026-04-14",
    "2026-04-15",
    "2026-04-16",
    "2026-04-17",
    "2026-04-20",
    "2026-04-21",
    "2026-04-22",
    "2026-04-23",
    "2026-04-24",
    "2026-04-27",
    "2026-04-28",
    "2026-04-29",
    "2026-04-30",
    "2026-05-01",
    "2026-05-04",
    "2026-05-05",
    "2026-05-06",
    "2026-05-07",
    "2026-05-08",
    "2026-05-11",
    "2026-05-12",
    "2026-05-13",
    "2026-05-14",
    "2026-05-15",
    "2026-05-18",
    "2026-05-19",
    "2026-05-20",
    "2026-05-21",
    "2026-05-22",
    "2026-05-26",
    "2026-05-27",
    "2026-05-28",
    "2026-05-29",
    "2026-06-01",
    "2026-06-02",
    "2026-06-03",
    "2026-06-04",
    "2026-06-05",
    "2026-06-08",
    "2026-06-09",
    "2026-06-10",
    "2026-06-11",
    "2026-06-12",
    "2026-06-15",
    "2026-06-16",
    "2026-06-17",
    "2026-06-18",
    "2026-06-22",
    "2026-06-23",
    "2026-06-24",
    "2026-06-25",
    "2026-06-26",
    "2026-06-29",
    "2026-06-30",
    "2026-07-01",
    "2026-07-02",
    "2026-07-06",
    "2026-07-07",
    "2026-07-08",
    "2026-07-09",
    "2026-07-10",
    "2026-07-13",
    "2026-07-14",
    "2026-07-15",
    "2026-07-16",
    "2026-07-17"
  ],
  "estimands": {
    "delta_b1": "QLIKE(B0)-QLIKE(B1a)",
    "delta_b2": "QLIKE(B1a)-QLIKE(B2)",
    "positive_direction": "expanded_information_set_better",
    "primary": "delta_b2"
  },
  "feature_design_outcome_blind": true,
  "forecast_floor": 1e-12,
  "holdout_reads": 0,
  "holdout_sessions": [
    "2026-07-20",
    "2026-07-21",
    "2026-07-22",
    "2026-07-23",
    "2026-07-24",
    "2026-07-27",
    "2026-07-28",
    "2026-07-29",
    "2026-07-30",
    "2026-07-31"
  ],
  "inference": {
    "bootstrap_repetitions": 10000,
    "cluster_unit": "XNYS_SESSION_DATE_WITH_ALL_ASSETS",
    "confirmatory_family": [
      "delta_b1",
      "delta_b2"
    ],
    "multiplicity": "Holm"
  },
  "information_sets": {
    "B0": [
      "spot",
      "lagged_rv_5m",
      "lagged_rv_30m",
      "lagged_return_5m",
      "lagged_volume_5m",
      "session_minute",
      "asset_identity"
    ],
    "B1a_addition": [
      "massive_atm_iv_30_60_dte"
    ],
    "B2_addition": [
      "b2_log_trade_count",
      "b2_unique_contract_share",
      "b2_log_mean_trade_premium",
      "b2_log_max_trade_premium",
      "b2_call_put_premium_imbalance_scaled",
      "b2_execution_side_premium_imbalance",
      "b2_repeated_contract_premium_share",
      "b2_strike_concentration",
      "b2_expiry_concentration"
    ]
  },
  "manifest_sha256": "ef77a20a4c0dde602e1daf29a3cbcbc698ccdb2b9acc0ce611cd0b6bc6b5273b",
  "metrics": {
    "primary": "QLIKE",
    "secondary": [
      "MAE",
      "RMSE"
    ]
  },
  "missingness": {
    "artificial_balancing": false,
    "provider_missingness_requires_reason": true,
    "silent_imputation": false,
    "strategy": "COMMON_COMPLETE_CASE",
    "valid_empty_activity_ratio": 0
  },
  "models": {
    "confirmatory": {
      "alpha_grid": [
        0.0,
        0.01,
        0.1,
        1.0
      ],
      "link": "log_fixed_by_estimator",
      "max_iter": 2000,
      "name": "GammaRegressor",
      "role": "CONFIRMATORY",
      "tolerance": 1e-08
    },
    "robustness": {
      "grid": {
        "learning_rate": [
          0.03,
          0.05
        ],
        "max_depth": [
          3,
          5
        ],
        "min_child_samples": [
          50
        ],
        "n_estimators": [
          200,
          500
        ],
        "num_leaves": [
          7,
          15
        ],
        "reg_lambda": [
          1.0
        ]
      },
      "name": "LGBMRegressor",
      "objective": "gamma",
      "role": "ROBUSTNESS_CHALLENGER"
    }
  },
  "outcome_reporting": "RETAIN_ALL_POSITIVE_NEGATIVE_AND_NULL_RESULTS",
  "outer_folds": [
    {
      "fold": 1,
      "test_end": "2026-06-03",
      "test_start": "2026-05-20",
      "train_end": "2026-05-19"
    },
    {
      "fold": 2,
      "test_end": "2026-06-17",
      "test_start": "2026-06-04",
      "train_end": "2026-06-03"
    },
    {
      "fold": 3,
      "test_end": "2026-07-02",
      "test_start": "2026-06-18",
      "train_end": "2026-06-17"
    },
    {
      "fold": 4,
      "test_end": "2026-07-17",
      "test_start": "2026-07-06",
      "train_end": "2026-07-02"
    }
  ],
  "provenance": {
    "branch": "001-pit-options-rv30-recovery",
    "commit": "09fb58032960c3d3b8359318ba2ee97d068668a3",
    "design_sha256": "8e90862df0c10572a53490f77eba0af04ab88dc24e0495accb9c58bd72373298",
    "python_version": "3.12.12",
    "spec_kit_commit": "e9aaf1af4104436c09a0d7815752503a6ee16780",
    "uv_lock_sha256": "df4020602f3ed9328ea08383f843e0eb0c52d2225219cb1711aef4c208d7b53c",
    "worktree_dirty": true
  },
  "purge_embargo_minutes": 30,
  "schema_version": "phase5-preregistration-1.0",
  "seed": 650,
  "session_manifest_sha256": "8a38373638f7411d6a8e10dd77a0706d13682b33f1f828e53243388ce66c21b8",
  "stability": [
    "asset",
    "session_tercile",
    "development_defined_volatility_regime",
    "fmp_delay_1_vs_2_minutes",
    "b2_delay_60_120_300_seconds"
  ],
  "status": "FROZEN_BEFORE_MODEL_OR_QLIKE",
  "target": {
    "horizon_minutes": 30,
    "name": "RV30",
    "price_count": 31,
    "return_count": 30
  },
  "timing": {
    "b2_primary_delay_seconds": 60,
    "b2_sensitivity_delay_seconds": [
      120,
      300
    ],
    "created_at_semantics": "OPERATIONAL_AVAILABILITY_PROXY_NOT_PUBLICATION_TIME",
    "fmp_primary_delay_minutes": 1,
    "fmp_sensitivity_delay_minutes": 2
  }
}
